<?xml version="1.0" encoding="UTF-8"?>
<!DOCTYPE Projekt SYSTEM "Uebung2.dtd">

<Projekt Aufgabe="Schreibe ein Buch" Deadline="23453">
    <Mitarbeiter ID="3432" Vorgesetzter="3432"> <!--Der Vorgesetzte hat sich selbst als Referenz-->
        <Vorname>Ralf</Vorname>
        <Nachname>Stoewing</Nachname>
    </Mitarbeiter>
    <Mitarbeiter ID="asdfasd" Vorgesetzte="3223">
        <Vorname>Erik</Vorname>
        <Nachname>Mindermann</Nachname>
        <Skill>Softwareentwickler</Skill>
    </Mitarbeiter>
    <Mitarbeiter ID="asdjkl" Vorgesetzte="dasdfa">
        <Vorname>Natascha</Vorname>
        <Nachname>Meinhardt</Nachname>
        <Skill></Skill>
    </Mitarbeiter>
    
    <Team Teamleiter="201502" Teilaufgabe="" Deadline="">
        <Teammitglied ID="3242"/>
        <Teammitglied ID="2342"/>
        <Teammitglied ID="23432" />
    </Team>
    
</Projekt>